<?xml version="1.0"?>

<!DOCTYPE city SYSTEM "city.dtd">

<city name="Zurich">

	<station name="Central" x="100.0" y="0.0"/>
	<station name="Bahnhofplatz/HB" x="-200.0" y="0.0"/>
	<station name="Bahnhofstrasse/HB" x="-100.0" y="-50.0"/>
	<station name="Bahnhofquai/HB" x="-100.0" y="100.0"/>
	<station name="Haldenegg" x="300.0" y="200.0"/>
	<station name="ETH/Universitaetsspital" x="500.0" y="50.0"/>
	<station name="Sonneggstrasse" x="300.0" y="400.0"/>
	<station name="Rudolf-Brun-Bruecke" x="100.0" y="-100.0"/>

	<line name="4" kind="tram">
		<stop name="Bahnhofquai/HB"/>
		<stop name="Central"/>
		<stop name="Rudolf-Brun-Bruecke"/>
	</line>
	<line name="6" kind="tram">
		<stop name="Bahnhofstrasse/HB"/>
		<stop name="Central"/>
		<stop name="Haldenegg"/>
		<stop name="ETH/Universitaetsspital"/>		
	</line>
	<line name="7" kind="tram">
		<stop name="Bahnhofstrasse/HB"/>
		<stop name="Central"/>
		<stop name="Haldenegg"/>
		<stop name="Sonneggstrasse"/>		
	</line>
	<line name="10" kind="tram">
		<stop name="Bahnhofplatz/HB"/>
		<stop name="Central"/>
		<stop name="Haldenegg"/>
		<stop name="ETH/Universitaetsspital"/>		
	</line>
	<line name="15" kind="tram">
		<stop name="Rudolf-Brun-Bruecke"/>
		<stop name="Central"/>
		<stop name="Haldenegg"/>
		<stop name="Sonneggstrasse"/>		
	</line>
	
</city>